<?xml version="1.0"?>
<!DOCTYPE Report
[
<!ELEMENT Report (General ,(Doc|BPT)) >
<!ATTLIST Report ver CDATA #REQUIRED tmZone CDATA #REQUIRED>

<!ELEMENT General ( DocLocation ) >
<!ATTLIST General productName CDATA #REQUIRED productVer CDATA #REQUIRED os CDATA #REQUIRED host CDATA #REQUIRED qcserver CDATA #IMPLIED qcproject CDATA #IMPLIED SolManSolutionId CDATA #IMPLIED SolManProjectId CDATA #IMPLIED SolManTestPlanId CDATA #IMPLIED SolManTestPackageId CDATA #IMPLIED SolManUserInfoData CDATA #IMPLIED  >

<!ELEMENT BPT (DName,Res,DVer?,TSet?,TInst?,NodeArgs,AdditionalInfo*,Doc*) >
<!ATTLIST BPT rID ID #REQUIRED >

<!ELEMENT Doc (DName,ConfName?,Res,DVer?,TSet?,TInst?,RunType?,DT?,AdditionalInfo*,Step*,DIter*,Step*,Action*,Doc*,Summary?,TestMaintenanceSummary*,NodeArgs?) >
<!ATTLIST Doc rID ID #REQUIRED type (Test|BC|BPTWrapperTest|Flow|Group|Action) "Test" productName CDATA #REQUIRED BCIter CDATA #IMPLIED >

<!ELEMENT RunType ( #PCDATA )>
<!ATTLIST RunType fmStep (False|True) "False" batch (False|True) "False" upDesc (False|True) "False" upChk (False|True) "False" upAS (False|True) "False">

<!ELEMENT DName ( #PCDATA ) >

<!ELEMENT ConfName ( #PCDATA ) >

<!ELEMENT Res ( #PCDATA ) >

<!ELEMENT AdditionalInfo (AdditionalDataName,AdditionalDataValue ) >

<!ELEMENT AdditionalDataName ( #PCDATA ) >

<!ELEMENT AdditionalDataValue ( #PCDATA ) >

<!ELEMENT DVer ( #PCDATA ) >

<!ELEMENT TSet ( #PCDATA ) >

<!ELEMENT TInst ( #PCDATA ) >

<!ELEMENT DIter (Step*,Action+,Summary?,NodeArgs)>
<!ATTLIST DIter rID ID #REQUIRED iterID CDATA #REQUIRED>

<!ELEMENT DocLocation ( #PCDATA )>

<!ELEMENT Action (AName,AIter*,(Step|HtmlStep|Action)*, Summary,ActionMaintenanceSummary*, NodeArgs ) >
<!ATTLIST Action rID ID #REQUIRED>

<!ELEMENT AIter ((Step|HtmlStep|Action)*,DataMapping?, Summary?,NodeArgs) >
<!ATTLIST AIter rID ID #REQUIRED iterID CDATA #REQUIRED isCountable (False|True) "False" >

<!ELEMENT AName ( #PCDATA ) >

<!ELEMENT TestMaintenanceSummary (ActionMaintenanceSummary*) >
<!ATTLIST TestMaintenanceSummary ObjectsAdded CDATA #REQUIRED ObjectsUpdated CDATA #REQUIRED StepsUpdated CDATA #REQUIRED StepsComments CDATA #REQUIRED><!ELEMENT ActionMaintenanceSummary (ObjectChange* ) >
<!ATTLIST ActionMaintenanceSummary Action CDATA #REQUIRED Objects CDATA #REQUIRED Updated CDATA #REQUIRED LinesTotal CDATA #REQUIRED Added CDATA #REQUIRED LinesUpdated CDATA #REQUIRED>

<!ELEMENT ObjectChange  (Hierarchy, PropertyChangeList* ) >
<!ATTLIST ObjectChange Operation CDATA #IMPLIED OriginalRepository CDATA #IMPLIED>

<!ELEMENT PropertyChangeList (PropertyDef*) >

<!ELEMENT PropertyDef (OriginalValue, NewValue) >
<!ATTLIST PropertyDef PropName CDATA #REQUIRED OriginRegularExpression (True|False) "False" NewRegularExpression (True|False) "False" AddedProperty (True|False) "False" >

<!ELEMENT OriginalValue ( #PCDATA )>

<!ELEMENT NewValue ( #PCDATA )>

<!ELEMENT Hierarchy  (ObjectName, Hierarchy*) >
<!ATTLIST Hierarchy MicClass CDATA #REQUIRED>

<!ELEMENT ObjectName  ( #PCDATA ) >

<!ELEMENT Step (Obj,Details,Time,TimeTick* ,(Step|HtmlStep|Doc)*, DataMapping?, NodeArgs) >
<!ATTLIST Step rID ID #REQUIRED retval CDATA #IMPLIED>

<!ELEMENT HtmlStep (HTML,TimeTick*,(Step|HtmlStep|Doc)*,NodeArgs) >
<!ATTLIST HtmlStep rID ID #REQUIRED >

<!ELEMENT Obj ( #PCDATA ) >
<!ATTLIST Obj plainTxt (False|True) "True">

<!ELEMENT Details ( #PCDATA ) >
<!ATTLIST Details plainTxt (False|True) "True">

<!ELEMENT Time ( #PCDATA ) >

<!ELEMENT HTML ( #PCDATA ) >

<!ELEMENT Disp ( #PCDATA ) >

<!ELEMENT TimeTick ( #PCDATA ) >

<!ELEMENT DataMapping ( DataMappedItem* )>
<!ELEMENT DataMappedItem EMPTY >
<!ATTLIST DataMappedItem dsName CDATA #REQUIRED >
<!ATTLIST DataMappedItem rowId CDATA #REQUIRED >

<!ELEMENT NodeArgs (Disp,TopPane?,BtmPane?,ExtendedInfo? )>
<!ATTLIST NodeArgs eType CDATA #REQUIRED icon CDATA #REQUIRED nRep CDATA #REQUIRED UserNote CDATA #IMPLIED filter (False|True) "True">
<!ATTLIST NodeArgs status (Passed|Failed|Done|Warning|Information) "Done">
<!ATTLIST NodeArgs iconSel CDATA #IMPLIED nType CDATA #IMPLIED MovieMarker CDATA "">
<!ATTLIST NodeArgs Source CDATA #IMPLIED SourceLine CDATA #IMPLIED StepFlowItemKey CDATA #IMPLIED >

<!ELEMENT TopPane (Path)>

<!ELEMENT BtmPane ( (Path|WR)?,ASHilite?)>
<!ATTLIST BtmPane vType CDATA "HTML">

<!ELEMENT Path ( #PCDATA ) >

<!ELEMENT ASHilite ( #PCDATA ) >

<!ELEMENT WR ( #PCDATA ) >

<!ELEMENT ExtendedInfo ( StepData ) >

<!ATTLIST ExtendedInfo StepType CDATA #REQUIRED>
<!ELEMENT DT (NodeArgs) >
<!ATTLIST DT rID ID #REQUIRED>

<!ELEMENT Summary (Param*)>
<!ATTLIST Summary sTime CDATA #IMPLIED eTime CDATA #IMPLIED passed CDATA #IMPLIED failed CDATA #IMPLIED warnings CDATA #IMPLIED retval CDATA #IMPLIED stopped (False|True) "False" >

<!ELEMENT Param (ParamName,ParamVal)+ >
<!ATTLIST Param paramInOut (In|Out) "In">

<!ELEMENT ParamName ( #PCDATA ) >

<!ELEMENT ParamVal ( #PCDATA ) >

]
>
<Report ver="2.0" tmZone="India Standard Time">
<General productName="Micro Focus UFT One" productVer="2021" os="Windows 10" host="vm001"><DocLocation><![CDATA[C:\Users\sfjbs\Desktop\UFT\Framework\DataDrivenFramework\Driver\Driver]]></DocLocation></General>
<Doc rID="T1"   productName= "Micro Focus UFT One"  >
<DName><![CDATA[Driver]]></DName>
<Res><![CDATA[Res32]]></Res>
<DT rID="T2">
<NodeArgs eType="Table" icon="2" nRep="4" filter="False" >
<Disp><![CDATA[Run-Time Data Table]]></Disp>
<BtmPane vType="Table" >
<Path><![CDATA[Default.xlsx]]></Path>
</BtmPane>
</NodeArgs>
</DT>
<DIter rID="T3" iterID="1" >
<Action rID="T4">
<AName><![CDATA[Action1]]></AName>
<Step rID="T5">
<Obj plainTxt="False" ><![CDATA[tr1]]></Obj>
<Details plainTxt="False" ><![CDATA[Transaction "tr1" started.]]></Details>
<Time><![CDATA[4/3/2022 - 12:31:04]]></Time>
<TimeTick>1648969264</TimeTick>
<NodeArgs eType="Transaction" icon="5" nRep="8" nType="Start Transaction" Source="Action1" SourceLine="3" >
<Disp><![CDATA[tr1]]></Disp>
</NodeArgs>
</Step>
<Step rID="T6">
<Obj plainTxt="False" ><![CDATA[Micro Focus MyFlight Sample]]></Obj>
<Details plainTxt="False" ><![CDATA[WpfWindow]]></Details>
<Time><![CDATA[4/3/2022 - 12:31:31]]></Time>
<TimeTick>1648969291</TimeTick>
<Step rID="T7">
<Obj plainTxt="False" ><![CDATA[WpfTabStrip.Select]]></Obj>
<Details plainTxt="False" ><![CDATA["SEARCH ORDER"]]></Details>
<Time><![CDATA[4/3/2022 - 12:31:31]]></Time>
<TimeTick>1648969291</TimeTick>
<NodeArgs eType="Replay" icon="7" nRep="15" >
<Disp><![CDATA[WpfTabStrip.Select]]></Disp>
</NodeArgs>
</Step>
<Step rID="T8">
<Obj plainTxt="False" ><![CDATA[byNumberRadio.Set]]></Obj>
<Details plainTxt="False" ><![CDATA[]]></Details>
<Time><![CDATA[4/3/2022 - 12:31:31]]></Time>
<TimeTick>1648969291</TimeTick>
<NodeArgs eType="Replay" icon="8" nRep="17" >
<Disp><![CDATA[byNumberRadio.Set]]></Disp>
</NodeArgs>
</Step>
<Step rID="T9">
<Obj plainTxt="False" ><![CDATA[byNumberWatermark.Set]]></Obj>
<Details plainTxt="False" ><![CDATA["7"]]></Details>
<Time><![CDATA[4/3/2022 - 12:31:32]]></Time>
<TimeTick>1648969292</TimeTick>
<NodeArgs eType="Replay" icon="9" nRep="19" >
<Disp><![CDATA[byNumberWatermark.Set]]></Disp>
</NodeArgs>
</Step>
<Step rID="T10">
<Obj plainTxt="False" ><![CDATA[SEARCH.Click]]></Obj>
<Details plainTxt="False" ><![CDATA[]]></Details>
<Time><![CDATA[4/3/2022 - 12:31:32]]></Time>
<TimeTick>1648969292</TimeTick>
<NodeArgs eType="Replay" icon="10" nRep="21" >
<Disp><![CDATA[SEARCH.Click]]></Disp>
</NodeArgs>
</Step>
<Step rID="T11">
<Obj plainTxt="False" ><![CDATA[NEW SEARCH.Click]]></Obj>
<Details plainTxt="False" ><![CDATA[]]></Details>
<Time><![CDATA[4/3/2022 - 12:31:33]]></Time>
<TimeTick>1648969293</TimeTick>
<NodeArgs eType="Replay" icon="10" nRep="23" >
<Disp><![CDATA[NEW SEARCH.Click]]></Disp>
</NodeArgs>
</Step>
<Step rID="T12">
<Obj plainTxt="False" ><![CDATA[Micro Focus MyFlight Sample.Exist]]></Obj>
<Details plainTxt="False" ><![CDATA["Object exists"]]></Details>
<Time><![CDATA[4/3/2022 - 12:31:33]]></Time>
<TimeTick>1648969293</TimeTick>
<NodeArgs eType="Replay" icon="6" nRep="24" >
<Disp><![CDATA[Micro Focus MyFlight Sample.Exist]]></Disp>
</NodeArgs>
</Step>
<NodeArgs eType="Context" icon="6" nRep="14" >
<Disp><![CDATA[Micro Focus MyFlight Sample]]></Disp>
</NodeArgs>
</Step>
<Step rID="T13">
<Obj ><![CDATA[openOrder]]></Obj>
<Details ><![CDATA[openOrder Successful]]></Details>
<Time><![CDATA[4/3/2022 - 12:31:33]]></Time>
<TimeTick>1648969293</TimeTick>
<NodeArgs eType="User" icon="11" nRep="25" status="Passed" >
<Disp><![CDATA[openOrder]]></Disp>
</NodeArgs>
</Step>
<Step rID="T14">
<Obj plainTxt="False" ><![CDATA[Micro Focus MyFlight Sample]]></Obj>
<Details plainTxt="False" ><![CDATA[WpfWindow]]></Details>
<Time><![CDATA[4/3/2022 - 12:31:35]]></Time>
<TimeTick>1648969295</TimeTick>
<Step rID="T15">
<Obj plainTxt="False" ><![CDATA[WpfTabStrip.Select]]></Obj>
<Details plainTxt="False" ><![CDATA["SEARCH ORDER"]]></Details>
<Time><![CDATA[4/3/2022 - 12:31:35]]></Time>
<TimeTick>1648969295</TimeTick>
<NodeArgs eType="Replay" icon="7" nRep="28" >
<Disp><![CDATA[WpfTabStrip.Select]]></Disp>
</NodeArgs>
</Step>
<Step rID="T16">
<Obj plainTxt="False" ><![CDATA[byNumberRadio.Set]]></Obj>
<Details plainTxt="False" ><![CDATA[]]></Details>
<Time><![CDATA[4/3/2022 - 12:31:36]]></Time>
<TimeTick>1648969296</TimeTick>
<NodeArgs eType="Replay" icon="8" nRep="30" >
<Disp><![CDATA[byNumberRadio.Set]]></Disp>
</NodeArgs>
</Step>
<Step rID="T17">
<Obj plainTxt="False" ><![CDATA[byNumberWatermark.Set]]></Obj>
<Details plainTxt="False" ><![CDATA["3"]]></Details>
<Time><![CDATA[4/3/2022 - 12:31:36]]></Time>
<TimeTick>1648969296</TimeTick>
<NodeArgs eType="Replay" icon="9" nRep="32" >
<Disp><![CDATA[byNumberWatermark.Set]]></Disp>
</NodeArgs>
</Step>
<Step rID="T18">
<Obj plainTxt="False" ><![CDATA[SEARCH.Click]]></Obj>
<Details plainTxt="False" ><![CDATA[]]></Details>
<Time><![CDATA[4/3/2022 - 12:31:36]]></Time>
<TimeTick>1648969296</TimeTick>
<NodeArgs eType="Replay" icon="10" nRep="34" >
<Disp><![CDATA[SEARCH.Click]]></Disp>
</NodeArgs>
</Step>
<Step rID="T19">
<Obj plainTxt="False" ><![CDATA[NEW SEARCH.Click]]></Obj>
<Details plainTxt="False" ><![CDATA[]]></Details>
<Time><![CDATA[4/3/2022 - 12:31:36]]></Time>
<TimeTick>1648969296</TimeTick>
<NodeArgs eType="Replay" icon="10" nRep="36" >
<Disp><![CDATA[NEW SEARCH.Click]]></Disp>
</NodeArgs>
</Step>
<Step rID="T20">
<Obj plainTxt="False" ><![CDATA[Micro Focus MyFlight Sample.Exist]]></Obj>
<Details plainTxt="False" ><![CDATA["Object exists"]]></Details>
<Time><![CDATA[4/3/2022 - 12:31:36]]></Time>
<TimeTick>1648969296</TimeTick>
<NodeArgs eType="Replay" icon="6" nRep="37" >
<Disp><![CDATA[Micro Focus MyFlight Sample.Exist]]></Disp>
</NodeArgs>
</Step>
<NodeArgs eType="Context" icon="6" nRep="27" >
<Disp><![CDATA[Micro Focus MyFlight Sample]]></Disp>
</NodeArgs>
</Step>
<Step rID="T21">
<Obj ><![CDATA[openOrder]]></Obj>
<Details ><![CDATA[openOrder Successful]]></Details>
<Time><![CDATA[4/3/2022 - 12:31:36]]></Time>
<TimeTick>1648969296</TimeTick>
<NodeArgs eType="User" icon="11" nRep="38" status="Passed" >
<Disp><![CDATA[openOrder]]></Disp>
</NodeArgs>
</Step>
<Step rID="T22">
<Obj plainTxt="False" ><![CDATA[Micro Focus MyFlight Sample]]></Obj>
<Details plainTxt="False" ><![CDATA[WpfWindow]]></Details>
<Time><![CDATA[4/3/2022 - 12:31:38]]></Time>
<TimeTick>1648969298</TimeTick>
<Step rID="T23">
<Obj plainTxt="False" ><![CDATA[WpfTabStrip.Select]]></Obj>
<Details plainTxt="False" ><![CDATA["SEARCH ORDER"]]></Details>
<Time><![CDATA[4/3/2022 - 12:31:38]]></Time>
<TimeTick>1648969298</TimeTick>
<NodeArgs eType="Replay" icon="7" nRep="41" >
<Disp><![CDATA[WpfTabStrip.Select]]></Disp>
</NodeArgs>
</Step>
<Step rID="T24">
<Obj plainTxt="False" ><![CDATA[byNumberRadio.Set]]></Obj>
<Details plainTxt="False" ><![CDATA[]]></Details>
<Time><![CDATA[4/3/2022 - 12:31:38]]></Time>
<TimeTick>1648969298</TimeTick>
<NodeArgs eType="Replay" icon="8" nRep="43" >
<Disp><![CDATA[byNumberRadio.Set]]></Disp>
</NodeArgs>
</Step>
<Step rID="T25">
<Obj plainTxt="False" ><![CDATA[byNumberWatermark.Set]]></Obj>
<Details plainTxt="False" ><![CDATA["1"]]></Details>
<Time><![CDATA[4/3/2022 - 12:31:38]]></Time>
<TimeTick>1648969298</TimeTick>
<NodeArgs eType="Replay" icon="9" nRep="45" >
<Disp><![CDATA[byNumberWatermark.Set]]></Disp>
</NodeArgs>
</Step>
<Step rID="T26">
<Obj plainTxt="False" ><![CDATA[SEARCH.Click]]></Obj>
<Details plainTxt="False" ><![CDATA[]]></Details>
<Time><![CDATA[4/3/2022 - 12:31:39]]></Time>
<TimeTick>1648969299</TimeTick>
<NodeArgs eType="Replay" icon="10" nRep="47" >
<Disp><![CDATA[SEARCH.Click]]></Disp>
</NodeArgs>
</Step>
<Step rID="T27">
<Obj plainTxt="False" ><![CDATA[NEW SEARCH.Click]]></Obj>
<Details plainTxt="False" ><![CDATA[]]></Details>
<Time><![CDATA[4/3/2022 - 12:31:39]]></Time>
<TimeTick>1648969299</TimeTick>
<NodeArgs eType="Replay" icon="10" nRep="49" >
<Disp><![CDATA[NEW SEARCH.Click]]></Disp>
</NodeArgs>
</Step>
<Step rID="T28">
<Obj plainTxt="False" ><![CDATA[Micro Focus MyFlight Sample.Exist]]></Obj>
<Details plainTxt="False" ><![CDATA["Object exists"]]></Details>
<Time><![CDATA[4/3/2022 - 12:31:39]]></Time>
<TimeTick>1648969299</TimeTick>
<NodeArgs eType="Replay" icon="6" nRep="50" >
<Disp><![CDATA[Micro Focus MyFlight Sample.Exist]]></Disp>
</NodeArgs>
</Step>
<NodeArgs eType="Context" icon="6" nRep="40" >
<Disp><![CDATA[Micro Focus MyFlight Sample]]></Disp>
</NodeArgs>
</Step>
<Step rID="T29">
<Obj ><![CDATA[openOrder]]></Obj>
<Details ><![CDATA[openOrder Successful]]></Details>
<Time><![CDATA[4/3/2022 - 12:31:39]]></Time>
<TimeTick>1648969299</TimeTick>
<NodeArgs eType="User" icon="11" nRep="51" status="Passed" >
<Disp><![CDATA[openOrder]]></Disp>
</NodeArgs>
</Step>
<Step rID="T30">
<Obj plainTxt="False" ><![CDATA[Micro Focus MyFlight Sample]]></Obj>
<Details plainTxt="False" ><![CDATA[WpfWindow]]></Details>
<Time><![CDATA[4/3/2022 - 12:31:40]]></Time>
<TimeTick>1648969300</TimeTick>
<Step rID="T31">
<Obj plainTxt="False" ><![CDATA[WpfTabStrip.Select]]></Obj>
<Details plainTxt="False" ><![CDATA["SEARCH ORDER"]]></Details>
<Time><![CDATA[4/3/2022 - 12:31:40]]></Time>
<TimeTick>1648969300</TimeTick>
<NodeArgs eType="Replay" icon="7" nRep="54" >
<Disp><![CDATA[WpfTabStrip.Select]]></Disp>
</NodeArgs>
</Step>
<Step rID="T32">
<Obj plainTxt="False" ><![CDATA[byNumberRadio.Set]]></Obj>
<Details plainTxt="False" ><![CDATA[]]></Details>
<Time><![CDATA[4/3/2022 - 12:31:41]]></Time>
<TimeTick>1648969301</TimeTick>
<NodeArgs eType="Replay" icon="8" nRep="56" >
<Disp><![CDATA[byNumberRadio.Set]]></Disp>
</NodeArgs>
</Step>
<Step rID="T33">
<Obj plainTxt="False" ><![CDATA[byNumberWatermark.Set]]></Obj>
<Details plainTxt="False" ><![CDATA["6"]]></Details>
<Time><![CDATA[4/3/2022 - 12:31:41]]></Time>
<TimeTick>1648969301</TimeTick>
<NodeArgs eType="Replay" icon="9" nRep="58" >
<Disp><![CDATA[byNumberWatermark.Set]]></Disp>
</NodeArgs>
</Step>
<Step rID="T34">
<Obj plainTxt="False" ><![CDATA[SEARCH.Click]]></Obj>
<Details plainTxt="False" ><![CDATA[]]></Details>
<Time><![CDATA[4/3/2022 - 12:31:41]]></Time>
<TimeTick>1648969301</TimeTick>
<NodeArgs eType="Replay" icon="10" nRep="60" >
<Disp><![CDATA[SEARCH.Click]]></Disp>
</NodeArgs>
</Step>
<Step rID="T35">
<Obj plainTxt="False" ><![CDATA[NEW SEARCH.Click]]></Obj>
<Details plainTxt="False" ><![CDATA[]]></Details>
<Time><![CDATA[4/3/2022 - 12:31:41]]></Time>
<TimeTick>1648969301</TimeTick>
<NodeArgs eType="Replay" icon="10" nRep="62" >
<Disp><![CDATA[NEW SEARCH.Click]]></Disp>
</NodeArgs>
</Step>
<Step rID="T36">
<Obj plainTxt="False" ><![CDATA[Micro Focus MyFlight Sample.Exist]]></Obj>
<Details plainTxt="False" ><![CDATA["Object exists"]]></Details>
<Time><![CDATA[4/3/2022 - 12:31:41]]></Time>
<TimeTick>1648969301</TimeTick>
<NodeArgs eType="Replay" icon="6" nRep="63" >
<Disp><![CDATA[Micro Focus MyFlight Sample.Exist]]></Disp>
</NodeArgs>
</Step>
<NodeArgs eType="Context" icon="6" nRep="53" >
<Disp><![CDATA[Micro Focus MyFlight Sample]]></Disp>
</NodeArgs>
</Step>
<Step rID="T37">
<Obj ><![CDATA[openOrder]]></Obj>
<Details ><![CDATA[openOrder Successful]]></Details>
<Time><![CDATA[4/3/2022 - 12:31:41]]></Time>
<TimeTick>1648969301</TimeTick>
<NodeArgs eType="User" icon="11" nRep="64" status="Passed" >
<Disp><![CDATA[openOrder]]></Disp>
</NodeArgs>
</Step>
<Step rID="T38">
<Obj plainTxt="False" ><![CDATA[Micro Focus MyFlight Sample]]></Obj>
<Details plainTxt="False" ><![CDATA[WpfWindow]]></Details>
<Time><![CDATA[4/3/2022 - 12:31:43]]></Time>
<TimeTick>1648969303</TimeTick>
<Step rID="T39">
<Obj plainTxt="False" ><![CDATA[WpfTabStrip.Select]]></Obj>
<Details plainTxt="False" ><![CDATA["SEARCH ORDER"]]></Details>
<Time><![CDATA[4/3/2022 - 12:31:43]]></Time>
<TimeTick>1648969303</TimeTick>
<NodeArgs eType="Replay" icon="7" nRep="67" >
<Disp><![CDATA[WpfTabStrip.Select]]></Disp>
</NodeArgs>
</Step>
<Step rID="T40">
<Obj plainTxt="False" ><![CDATA[byNumberRadio.Set]]></Obj>
<Details plainTxt="False" ><![CDATA[]]></Details>
<Time><![CDATA[4/3/2022 - 12:31:43]]></Time>
<TimeTick>1648969303</TimeTick>
<NodeArgs eType="Replay" icon="8" nRep="69" >
<Disp><![CDATA[byNumberRadio.Set]]></Disp>
</NodeArgs>
</Step>
<Step rID="T41">
<Obj plainTxt="False" ><![CDATA[byNumberWatermark.Set]]></Obj>
<Details plainTxt="False" ><![CDATA["3"]]></Details>
<Time><![CDATA[4/3/2022 - 12:31:44]]></Time>
<TimeTick>1648969304</TimeTick>
<NodeArgs eType="Replay" icon="9" nRep="71" >
<Disp><![CDATA[byNumberWatermark.Set]]></Disp>
</NodeArgs>
</Step>
<Step rID="T42">
<Obj plainTxt="False" ><![CDATA[SEARCH.Click]]></Obj>
<Details plainTxt="False" ><![CDATA[]]></Details>
<Time><![CDATA[4/3/2022 - 12:31:44]]></Time>
<TimeTick>1648969304</TimeTick>
<NodeArgs eType="Replay" icon="10" nRep="73" >
<Disp><![CDATA[SEARCH.Click]]></Disp>
</NodeArgs>
</Step>
<Step rID="T43">
<Obj plainTxt="False" ><![CDATA[NEW SEARCH.Click]]></Obj>
<Details plainTxt="False" ><![CDATA[]]></Details>
<Time><![CDATA[4/3/2022 - 12:31:44]]></Time>
<TimeTick>1648969304</TimeTick>
<NodeArgs eType="Replay" icon="10" nRep="75" >
<Disp><![CDATA[NEW SEARCH.Click]]></Disp>
</NodeArgs>
</Step>
<Step rID="T44">
<Obj plainTxt="False" ><![CDATA[Micro Focus MyFlight Sample.Exist]]></Obj>
<Details plainTxt="False" ><![CDATA["Object exists"]]></Details>
<Time><![CDATA[4/3/2022 - 12:31:44]]></Time>
<TimeTick>1648969304</TimeTick>
<NodeArgs eType="Replay" icon="6" nRep="76" >
<Disp><![CDATA[Micro Focus MyFlight Sample.Exist]]></Disp>
</NodeArgs>
</Step>
<NodeArgs eType="Context" icon="6" nRep="66" >
<Disp><![CDATA[Micro Focus MyFlight Sample]]></Disp>
</NodeArgs>
</Step>
<Step rID="T45">
<Obj ><![CDATA[openOrder]]></Obj>
<Details ><![CDATA[openOrder Successful]]></Details>
<Time><![CDATA[4/3/2022 - 12:31:44]]></Time>
<TimeTick>1648969304</TimeTick>
<NodeArgs eType="User" icon="11" nRep="77" status="Passed" >
<Disp><![CDATA[openOrder]]></Disp>
</NodeArgs>
</Step>
<Step rID="T46">
<Obj plainTxt="False" ><![CDATA[Micro Focus MyFlight Sample]]></Obj>
<Details plainTxt="False" ><![CDATA[WpfWindow]]></Details>
<Time><![CDATA[4/3/2022 - 12:31:47]]></Time>
<TimeTick>1648969307</TimeTick>
<Step rID="T47">
<Obj plainTxt="False" ><![CDATA[Micro Focus MyFlight Sample.Close]]></Obj>
<Details plainTxt="False" ><![CDATA[]]></Details>
<Time><![CDATA[4/3/2022 - 12:31:47]]></Time>
<TimeTick>1648969307</TimeTick>
<NodeArgs eType="Replay" icon="6" nRep="80" >
<Disp><![CDATA[Micro Focus MyFlight Sample.Close]]></Disp>
</NodeArgs>
</Step>
<Step rID="T48">
<Obj plainTxt="False" ><![CDATA[Micro Focus MyFlight Sample.Exist]]></Obj>
<Details plainTxt="False" ><![CDATA["Object does not exist"]]></Details>
<Time><![CDATA[4/3/2022 - 12:31:52]]></Time>
<TimeTick>1648969312</TimeTick>
<NodeArgs eType="Replay" icon="6" nRep="82" >
<Disp><![CDATA[Micro Focus MyFlight Sample.Exist]]></Disp>
</NodeArgs>
</Step>
<NodeArgs eType="Context" icon="6" nRep="79" >
<Disp><![CDATA[Micro Focus MyFlight Sample]]></Disp>
</NodeArgs>
</Step>
<Step rID="T49">
<Obj ><![CDATA[closeapp]]></Obj>
<Details ><![CDATA[closeapp Successful]]></Details>
<Time><![CDATA[4/3/2022 - 12:31:52]]></Time>
<TimeTick>1648969312</TimeTick>
<NodeArgs eType="User" icon="11" nRep="83" status="Passed" >
<Disp><![CDATA[closeapp]]></Disp>
</NodeArgs>
</Step>
<Step rID="T50">
<Obj plainTxt="False" ><![CDATA[tr1]]></Obj>
<Details plainTxt="False" ><![CDATA[Transaction "tr1" ended with "Pass" status (Total Duration: 50.1718 sec).]]></Details>
<Time><![CDATA[4/3/2022 - 12:31:54]]></Time>
<TimeTick>1648969314</TimeTick>
<NodeArgs eType="Transaction" icon="12" nRep="84" nType="End Transaction" Source="Action1" SourceLine="81" >
<Disp><![CDATA[tr1]]></Disp>
</NodeArgs>
</Step>
<Summary sTime="4/3/2022 - 12:31:04" eTime="4/3/2022 - 12:31:54" passed="6" failed="0" warnings="0" ></Summary>
<NodeArgs eType="StartAction" icon="4" nRep="7" status="Passed" >
<Disp><![CDATA[Action1 Summary]]></Disp>
</NodeArgs>
</Action>
<Action rID="T51">
<AName><![CDATA[Action2]]></AName>
<Summary sTime="4/3/2022 - 12:31:54" eTime="4/3/2022 - 12:31:55" passed="0" failed="0" warnings="0" ></Summary>
<NodeArgs eType="StartAction" icon="4" nRep="86" >
<Disp><![CDATA[Action2 Summary]]></Disp>
</NodeArgs>
</Action>
<Action rID="T52">
<AName><![CDATA[Action3]]></AName>
<Summary sTime="4/3/2022 - 12:31:55" eTime="4/3/2022 - 12:31:55" passed="0" failed="0" warnings="0" ></Summary>
<NodeArgs eType="StartAction" icon="4" nRep="88" >
<Disp><![CDATA[Action3 Summary]]></Disp>
</NodeArgs>
</Action>
<Action rID="T53">
<AName><![CDATA[Action4]]></AName>
<Summary sTime="4/3/2022 - 12:31:55" eTime="4/3/2022 - 12:31:55" passed="0" failed="0" warnings="0" ></Summary>
<NodeArgs eType="StartAction" icon="4" nRep="90" >
<Disp><![CDATA[Action4 Summary]]></Disp>
</NodeArgs>
</Action>
<NodeArgs eType="StartIteration" icon="3" nRep="6" status="Passed" >
<Disp><![CDATA[Driver Iteration 1 (Row 1)]]></Disp>
</NodeArgs>
</DIter>
<Summary sTime="4/3/2022 - 12:30:58" eTime="4/3/2022 - 12:31:55" passed="6" failed="0" warnings="0" ></Summary>
<NodeArgs eType="StartTest" icon="1" nRep="3" status="Passed" >
<Disp><![CDATA[Test Driver Summary]]></Disp>
</NodeArgs>
</Doc>
</Report>